### ISSUE TITLE
C-ares does not return the obtained ip when curl uses PF_UNSPEC 

### ISSUE THREAD

**Issue by JosephTharayil** [c-ares/c-ares#538]
Hi,

I am using curl 7.79.1 with c-ares 1.17.2. 

The issue I am noticing with c-ares is, when we don't specify the ip address to query for a domain name using the curl command and there is a timeout associated to it the resolution fails for the domain and curl as a consequence also fails. 
EX:
**# curl -v -m4 http://www.google.com
* STATE: INIT => CONNECT handle 0x1832040; line 1789 (connection #-5000)
* Added connection 0. The cache now contains 1 members
17:29:17.683962 IP 10.74.138.67.43796 > 10.174.75.167.53: 57533+ A? www.google.com. (32)
17:29:17.683990 IP 10.74.138.67.43796 > 10.174.75.167.53: 57533+ A? www.google.com. (32)
17:29:17.684224 IP 10.74.138.67.43796 > 10.174.75.167.53: 17880+ AAAA? www.google.com. (32)
17:29:17.684244 IP 10.74.138.67.43796 > 10.174.75.167.53: 17880+ AAAA? www.google.com. (32)
* STATE: CONNECT => RESOLVING handle 0x1832040; line 1835 (connection #0)
17:29:17.684874 IP 10.174.75.167.53 > 10.74.138.67.43796: 57533* 1/0/0 A 142.250.195.228 (49)
17:29:17.684904 IP 10.174.75.167.53 > 10.74.138.67.43796: 57533* 1/0/0 A 142.250.195.228 (49)
17:29:17.684949 IP 10.174.75.167.53 > 10.74.138.67.43796: 57533* 1/0/0 A 142.250.195.228 (49)
17:29:17.684966 IP 10.174.75.167.53 > 10.74.138.67.43796: 57533* 1/0/0 A 142.250.195.228 (49)
* Resolving timed out after 4001 milliseconds
* multi_done
* The cache now contains 0 members
* Closing connection 0
* Expire cleared (transfer 0x1832040)
curl: (28) Resolving timed out after 4001 millisecond**s

how ever if we don't pass the timeout for resolving the domain the curl passes by using the ipv4 address. But this generally take a long time to timeout and use the ipv4 address. In my testing its over a minute always before returning with the resolved address. Some program using curl generally doesn't wait so long. So is it possible to send the partial query response back to curl before it time's out, so that it can use the ipv4 address at least and continue with its operations? 

I have tried it with c-ares 1.18.1 and its the same behavior.  

My test environment is ubuntu 18.04.1

Thanks

**Comment by bradh352** [comment]
This was fixed in c-ares 1.19.0 as per the changelog entry:

* Even if one address class returns a failure for ares_getaddrinfo() we should still return the results we have
