### ISSUE TITLE
ares_getaddrinfo hangs (no completion, no retry) after CNAME-no-AAAA answer triggers search-domain requery; intermittent under concurrent lookups

### ISSUE THREAD

**Issue by jimAppoly** [c-ares/c-ares#1280]
## Summary

`ares_getaddrinfo` (via libcurl's c-ares backend) intermittently never completes when resolving a hostname whose AAAA answer is a CNAME with no address records (NOERROR + CNAME in ANSWER + SOA in AUTHORITY). A packet capture shows c-ares receiving valid, fast responses to every query it sends — including a final NXDOMAIN to a search-domain requery — and then going silent: no further queries, no retries, no callback. The application (libcurl) eventually reports `Resolving timed out` when `CURLOPT_CONNECTTIMEOUT` expires.

The failure is timing-sensitive: it reproduces reliably when several concurrent lookups of the same name are in flight (curl_multi / PHP `Http::pool`), while isolated single lookups usually succeed — though successful lookups of this name often carry a ~1.3 s penalty, suggesting a lost/late leg recovered by a retry timer that does not fire in the hang case.

## Versions / environment

- c-ares **1.34.8** (Alpine 3.24 package `c-ares-1.34.8-r0`)
- curl / libcurl **8.21.0** (`curl-8.21.0-r0`, x86_64-alpine-linux-musl, c-ares backend)
- Affects both the `curl` CLI and PHP 8.5 ext-curl identically
- musl `getaddrinfo` / `gethostbyname` on the same host: never affected
- Container: rootless Podman (quadlet), resolver = aardvark-dns at `10.89.0.1` (answers in ~3 ms; verified well-behaved for case-randomization, EDNS/OPT, and concurrent load via crafted raw queries)
- `/etc/resolv.conf`: `search dns.podman` + `nameserver 10.89.0.1` (default podman network config; also reproduced with the search line removed — see Notes)

## Triggering DNS shape

`sandbox.api.traddal.com`:

- `A` → NOERROR: `CNAME d-76sunui72d.execute-api.us-east-2.amazonaws.com.` + 3 A records
- `AAAA` → NOERROR: the CNAME only, **no AAAA records**, SOA for `execute-api.us-east-2.amazonaws.com` in AUTHORITY

(Names with both A and AAAA, and CNAME-less A-only names, resolve normally in the same environment.)

## Packet capture of a hang (tcpdump, port 53, inside the netns)

Client is 10.89.0.7; resolver is 10.89.0.1. `CURLOPT_CONNECTTIMEOUT` was 8 s.

```
14:16:14.420751 IP 10.89.0.7.36438 > 10.89.0.1.53: 41587+ [1au] AAAA? sandbox.api.traddal.com. (64)
14:16:14.420834 IP 10.89.0.7.36438 > 10.89.0.1.53: 55401+ [1au] A? sandbox.api.traddal.com. (64)
14:16:14.424088 IP 10.89.0.1.53 > 10.89.0.7.36438: 55401 4/0/1 CNAME d-76sunui72d.execute-api.us-east-2.amazonaws.com., A 3.147.125.95, A 18.119.183.215, A 3.14.194.125 (159)
14:16:14.430297 IP 10.89.0.1.53 > 10.89.0.7.36438: 41587 1/1/1 CNAME d-76sunui72d.execute-api.us-east-2.amazonaws.com. (221)
14:16:14.430471 IP 10.89.0.7.36438 > 10.89.0.1.53: 38880+ [1au] AAAA? sandbox.api.traddal.com.dns.podman. (75)
14:16:14.430547 IP 10.89.0.1.53 > 10.89.0.7.36438: 38880 NXDomain 0/0/1 (75)
--- nothing further for the remaining ~8 s; curl reports "Resolving timed out after 8000 milliseconds" ---
```

Observations:

1. The A lookup **succeeded** with 3 addresses within 4 ms.
2. The AAAA NOERROR/CNAME-no-data answer caused a **search-domain requery of an already-multi-label, already-answered name** (`…traddal.com.dns.podman`), which is itself questionable.
3. After that requery's NXDOMAIN, c-ares neither completed the getaddrinfo (it holds valid A results) nor sent anything further — permanent hang until the caller's timeout.

## Reproduction

Reliable trigger — concurrent lookups of the triggering name (PHP, but plain curl_multi in C behaves the same; the CLI reproduces intermittently with repeated invocations):

```php
$mh = curl_multi_init();
for ($i = 0; $i < 8; $i++) {
    $ch = curl_init("https://sandbox.api.traddal.com/");
    curl_setopt_array($ch, [CURLOPT_RETURNTRANSFER => 1, CURLOPT_TIMEOUT => 7, CURLOPT_NOBODY => 1]);
    curl_multi_add_handle($mh, $ch);
}
do { curl_multi_exec($mh, $running); curl_multi_select($mh, 0.1); } while ($running > 0);
// intermittently: one or more handles fail with
// "cURL error 28: Resolving timed out after 5000 milliseconds"
```

Notes:

- `CURLOPT_IPRESOLVE_V4` does **not** avoid the hang (still times out resolving).
- An `/etc/hosts` entry for the name fully avoids it (hosts-file path unaffected).
- Removing the `search dns.podman` line reduced ambient failures but concurrent-pool hangs still occurred, so the search requery appears to be a symptom/amplifier rather than the sole cause.
- The same binary versions resolved this name fine for weeks; failures began when the domain's operator moved it to the `execute-api` CNAME (i.e. when the AAAA answer became CNAME-no-data), so the response shape is load-bearing.

## Related issues (checked before filing — none match this symptom)

- #73 (closed): negative AAAA answers triggering search-list retries — the requery in the capture above suggests this behaviour still exists in 1.34.8, but that issue describes extra queries, not a hang.
- #426 (closed): NODATA during search iteration treated as terminal after the parallel A/AAAA change (dbd4c44) — related family, but the symptom there is premature failure, not a never-completing lookup.
- The 1.34.7 changelog entry "Use-after-free / double-free in c-ares' query-completion handling, remotely triggerable via ares_getaddrinfo() over TCP" shows recent rework in query-completion handling; this hang (queries all answered, completion never fires) may be adjacent fallout — we see it on 1.34.8.

## Expected

`ares_getaddrinfo` should complete with the A results once the AAAA leg has a terminal answer (NODATA), and a NOERROR answer for a multi-label name should not trigger search-list requeries.

---

*Report prepared from a production debugging session (packet captures and environment available on request).*

**Comment by maxvisser** [comment]
Same symptom on 1.34.8 in a production PHP/Laravel workload, with a bisect that isolates it to c-ares.

```
Alpine 3.24.1, musl 1.2.6
curl 8.21.0 / libcurl 8.21.0, OpenSSL 3.5.7, c-ares 1.34.8, nghttp2 1.69.0
PHP 8.3.33-fpm, Guzzle 7.15.2
Kubernetes pod, 4 search domains, options ndots:5
```

The symptom is `cURL error 28: Resolving timed out after 300002 milliseconds`, always the caller's full CURLOPT_TIMEOUT, so the resolve never completes rather than being slow. Roughly 8 to 9 per working day against CNAME-fronted hosts.

Two consecutive builds of the same image, one week apart. The earlier one runs c-ares 1.34.6 and had zero occurrences in 39 days. The later one runs 1.34.8, started failing two hours after deploy and has averaged 8.6 per day over 24 days since. I diffed every shared library across all 29 layers of both images and libcares.so is the only .so that differs. libcurl, OpenSSL, musl and every PHP extension are byte-identical by sha256. The symbol diff shows three additions, ares_malloc_zero_array, ares_realloc_zero_array and ares_str_parse_uint, which map to the 1.34.7 overflow guards and PR #1158. We went from 1.34.6 straight to 1.34.8, so 1.34.7 was never deployed here.

Second data point: a different application in the same cluster, on the same nodes, through the same resolver and with the same resolv.conf layout, running 1.34.6 with libcurl 8.14.1. Zero occurrences in 62 days. Cluster-wide over that window the error appears only in the two namespaces that picked up 1.34.8.

Nothing is lost on the wire, which matches your capture. CoreDNS over a 16h window logged 20,747,459 requests against 20,747,459 responses, 23 SERVFAIL, 2 to 4 ms average upstream latency, and zero UDP InErrors or conntrack drops across the nodes. The hang is client-side.

The trigger shape matches yours. Every affected hostname is a CNAME chain to CloudFront with no AAAA, returning NOERROR with the CNAME in ANSWER and a SOA in AUTHORITY. 

One difference from your report that may widen the repro. You need concurrent lookups via curl_multi or Http::pool. We have no explicit concurrency in the application at all, no Http::pool, no GuzzleHttp\Pool, no requestAsync. These are plain synchronous Guzzle calls, with concurrency only at process level across php-fpm workers that each have their own channel. A single channel doing parallel A/AAAA plus a search-list requery may be enough to trigger it. It isn't reproducible on demand for us either: 200 sequential lookups from an affected pod showed nothing above a second, and we only see it under real traffic at 8 to 9 hangs per day out of millions of lookups.

We're rolling back to 1.34.6 on an otherwise identical image this week and I'll report back. Happy to run tracing or a debug build if that helps.

**Comment by dimbleby** [comment]
plausibly #1256

**Comment by maxvisser** [comment]
Downgrading to 1.34.6 worked for us, we are building c-ares from source right now as 1.34.6 is not available anymore on the offical alpine repo's
